{
  "requestId": "r-01J9KA7EXAMPLE0000",
  "revision": 43,
  "status": "running",
  "projectionDelta": {
    "revision": 43
  },
  "publicEvents": [
    {
      "seq": 0,
      "kind": "write",
      "addressHex": "0x7FF3A0",
      "byteLength": 13,
      "payloadHex": "48656c6c6f2c20737461636b21"
    }
  ]
}
